name,note,description,customField1_name,customField1_value,customField2_name,customField2_value,customField3_name,customField3_value,folder,dummy
BBVA Atocha ,Calle Atocha Plazuela de Anton Martin 59,Calle Atocha Plazuela de Anton Martin 59 Madrid,Alarm,1123,Camera ground floor,456s!fsdf,Camera First floor,P(km=5899@$,P-A-BBVA-MADR,0
BBVA Gran via,Calle Gran Via 60,Calle Gran Via 60 Madrid,Alarm,1122,Camera ground floor,ssdfsfFsdf,Camera First floor,ert456@85$,P-A-BBVA-MADR,0
ECI Callao,El Corte Ingles Pl. Del Callao 2,Pl. Del Callao 2 Madrid,Alarm,456789,Camera ground floor,123DDFrdftt$,Camera First floor,gddrtT0R(($,P-A-ECI-MADR,0
ECI Goya,El Corte Ingles Shopping mall - Calle de Goya 87,Shopping mall - Calle de Goya 87 Madrid,Building Access,15676,Camera ground floor,Ftr6(0T-45,Camera First floor,Ft459$%b-,P-A-ECI-MADR,0
ECI Catalunya,El Corte Ingles Shopping mall Pl. De Catalunya,Shopping mall Pl. De Catalunya Barcalona,Building Access,365521,Camera ground floor,sgrrt345d,Camera First floor,_5T0r=fdtGd56,P-A-ECI-CATA,0